{
  "$schema": "https://agent-project-os.org/schemas/acceptance-receipt-v1.schema.json",
  "acceptance_status": "accepted",
  "artifact": {
    "commit": "1111111111111111111111111111111111111111",
    "path": "contracts/order.schema.json",
    "protocol_version": "orders@2",
    "sha256": "aaaaaaaaaaaaaaaaaaaaaaaaaaaaaaaaaaaaaaaaaaaaaaaaaaaaaaaaaaaaaaaa",
    "version": "2.0.0"
  },
  "consumer": "service",
  "created_at": "2026-08-14T00:38:00Z",
  "evidence_refs": ["service-e2"],
  "producer": "contracts",
  "protocol_version": "1.0",
  "receipt_id": "orders-v2-receipt"
}
